"date","headline","url_address","text"
2018-07-05,"New Course: Support Vector Machines in R","https://www.datacamp.com/community/blog/course-support-vector-machines-r"," Support Vector Machines in R will help students develop an understanding of the SVM model as a classifier and gain practical experience using R¡¯s libsvm implementation from the e1071 package. Along the way, students will gain an intuitive understanding of important concepts, such as hard and soft margins, the kernel trick, different types of kernels, and how to tune SVM parameters. Get ready to classify data with this impressive model. This chapter introduces some key concepts of support vector machines through a simple 1-dimensional example. Students are also walked through the creation of a linearly separable dataset that is used in the subsequent chapter. Chapter 2 introduces students to the basic concepts of support vector machines by applying the svm algorithm to a dataset that is linearly separable. Key concepts are illustrated through ggplot visualizations that are built from the outputs of the algorithm and the role of the cost parameter is highlighted via a simple example. The chapter closes with a section on how the algorithm deals with multi-class problems. This chapter provides an introduction to polynomial kernels via a dataset that is radially separable (i.e. has a circular decision boundary). After demonstrating the inadequacy of linear kernels for this dataset, students will see how a simple transformation renders the problem linearly separable thus motivating an intuitive discussion of the kernel trick. Students will then apply the polynomial kernel to the dataset and tune the resulting classifier. Chapter 4 builds on the previous three chapters by introducing the highly flexible Radial Basis Function (RBF) kernel. Students will create a ""complex"" dataset that shows up the limitations of polynomial kernels. Then, following an intuitive motivation for the RBF kernel, students see how it addresses the shortcomings of the other kernels discussed in this course. The course requires the following prerequisites: Introduction to R Introduction to Machine Learning"
2018-07-05,"New Course: Interactive Maps with leaflet in R","https://www.datacamp.com/community/blog/course-maps-leaflet-r","Get ready to have some fun with maps! Interactive Maps with leaflet in R will give you the tools to make attractive and interactive web maps using spatial data and the tidyverse. In this course, you will create maps using the IPEDS dataset, which contains data on U.S. colleges and universities. Along the way, you will customize our maps using labels, popups, and custom markers, and add layers to enhance interactivity. Following the course, you will be able to create and customize your own interactive web maps to reveal patterns in your data. This chapter will introduce students to the htmlwidgets package and the leaflet package. Following this introduction, students will build their first interactive web map using leaflet. Through the process of creating this first map students will be introduced to many of the core features of the leaflet package, including adding different map tiles, setting the center point and zoom level, plotting single points based on latitude and longitude coordinates, and storing leaflet maps as objects. In this chapter students will build on the leaflet map they created in chapter 1 to create an interactive web map of every four year college in California. After plotting hundreds of points on an interactive leaflet map, students will learn to customize the markers on their leaflet map. This chapter will also how to color code markers based on a factor variable. In chapter 3, students will expand on their map of all four year colleges in California to create a map of all American colleges. First, in section 3.1 students will review and build on the material from Chapter 2 to create a map of all American colleges. Then students will re-plot the colleges on their leaflet map by sector (public, private, or for-profit) using groups to enable users to toggle the colleges that are displayed on the map. In section 3.3 students will learn to add multiple base maps so that users can toggle between multiple map tiles. In Chapter 4, students will learn to map polygons, which can be used to define geographic regions (e.g., zip codes, states, countries, etc.). Chapter 4 will start by plotting the zip codes in North Carolina that fall in the top quartile of mean family incomes. Students will learn to customize the polygons with color palettes and labels. Chapter 4 will conclude with adding a new layer to the map of every college in America that displays every zip code with a mean income of $200,000 or more during the 2015 tax year. Through the process of mapping zip codes students will learn about spatial data generally, geoJSON data, the @ symbol, and the addPolygons() function. This course requires the following prerequisites: Introduction to R Introduction to the Tidyverse"
