"site","date","headline","url_address","text"
"mastery",2018-07-16,"All of Statistics for Machine Learning","https://machinelearningmastery.com/all-of-statistics-for-machine-learning/","A foundation in statistics is required to be effective as a machine learning practitioner. The book ¡°All of Statistics¡± was written specifically to provide a foundation in probability and statistics for computer science undergraduates that may have an interest in data mining and machine learning. As such, it is often recommended as a book to machine learning practitioners interested in expanding their understanding of statistics. In this post, you will discover the book ¡°All of Statistics¡±, the topics it covers, and a reading list intended for machine learning practitioners. After reading this post, you will know: Let¡¯s get started. All of Statistics for Machine LearningPhoto by Chris Sorge, some rights reserved. The book ¡°All of Statistics: A Concise Course in Statistical Inference¡± was written by Larry Wasserman and released in 2004. All of Statistics Wasserman is a professor of statistics and data science at Carnegie Mellon University. The book is ambitious. It seeks to quickly bring computer science students up-to-speed with probability and statistics. As such, the topics covered by the book are very broad, perhaps broader than the average introductory textbooks. Taken literally, the title ¡°All of Statistics¡± is an exaggeration. But in spirit, the title is apt, as the book does cover a much broader range of topics than a typical introductory book on mathematical statistics. This book is for people who want to learn probability and statistics quickly. <U+2014> Page vii, All of Statistics: A Concise Course in Statistical Inference, 2004. The book is not for the average practitioner; it is intended for computer science undergraduate students. It does assume some prior knowledge in calculus and linear algebra. If you don¡¯t like equations or mathematical notation, this book is not for you. Interestingly, Wasserman wrote the book in response to the rise of data mining and machine learning in computer science occurring outside of classical statistics. He asserts in the preface the importance of having a grounding in statistics in order to be effective in machine learning. Using fancy tools like neural nets, boosting, and support vector machines without understanding basic statistics is like doing brain surgery before knowing how to use a band-aid. <U+2014> Pages vii-viii, All of Statistics: A Concise Course in Statistical Inference, 2004. The material is presented in a very clear and concise manner. A systematic approach is taken with brief descriptions of a method, equations describing its implementation, and worked examples to motivate the use of the method with sample code in R. In fact, the material is so compact that it often reads like a series of encyclopedia examples. This is great if you want to know how to implement a method, but very challenging if you are new to the methods and seeking intuitions. Take my free 7-day email crash course now (with sample code). Click to sign-up and also get a free PDF Ebook version of the course. Download Your FREE Mini-Course The choice of topics covered by the book is very broad, as mentioned in the previous section. This is great on the one hand as the reader is given exposure to advanced subjects early on. The downside of this aggressive scope is that topics are touched on briefly with very little hand holding. You are left to re-read sections until you get it. Let¡¯s look at the topics covered by the book. This is helpful to both get an idea of the presented scope of the field and the context for the topics that may interest you as a machine learning practitioner. The book is divided into three parts; they are: The first part of the book focuses on probability theory and formal language for describing uncertainty. The second part is focused on statistical inference. The third part focuses on specific methods and problems raised in the second part. The book does have a reference or encyclopedia feeling. As such, there are a lot of chapters, but each chapter is reasonably standalone. The book is divided into 24 chapters; they are: The preface for the book provides a useful glossary of terms mapping them from statistics to computer science. This ¡°Statistics/Data Mining Dictionary¡± is reproduced below. Statistics/Data Mining DictionaryTaken from ¡°All of Statistics¡°. All of the R code and datasets used in the worked examples in the book are available from Wasserman¡¯s homepage. This is very helpful as you can focus on experimenting with the examples rather than typing in the code and hoping that you got the syntax correct. I would not recommend this book to developers who have not touched statistics before. It¡¯s too challenging. I would recommend this book to computer science students who are in math-learning-mode. I would also recommend it to machine learning practitioners with some previous background in statistics or a strong mathematical foundation. If you are comfortable with mathematical notation and you know what you¡¯re looking for, this book is an excellent reference. You can flip to the topic or the method and get a crisp presentation. The problem is, for a machine learning practitioner, you do need to know about many of these topics, just not at the level of detail presented. Perhaps a shade lighter, at the intuition level. If you are up to it, it would be worth reading (or skimming) the following chapters in order to build a solid foundation in probability for statistics: Again, these are important topics, but you require a concept-level understanding only. For coverage of statistical hypothesis tests that you may use to interpret data and compare the skill of models, the following chapters are recommended reading: I would also recommend the chapter on the Bootstrap. It¡¯s just a great method to have in your head, but with a focus for either better understanding bagging and random forest or as a procedure for estimating confidence intervals of model skill. Finally, a statistical approach is used to present machine learning algorithms. I would recommend these chapters if you prefer a more mathematical treatment of regression and classification algorithms: I can read the mathematical presentation of statistics, but I prefer intuitions and working code. I am less likely to pick up this book from my bookcase, in favor of gentler treatments such as ¡°Statistics in Plain English¡± or application focused treatments such as ¡°Empirical Methods for Artificial Intelligence¡°. Do you agree with this reading list?
Let me know in the comments below. This section provides more resources on the topic if you are looking to go deeper. In this post, you discovered the book ¡°All of Statistics¡± that provides a broad and concise introduction to statistics. Specifically, you learned: Have you read this book?
What did you think of it? Let me know in the comments below. Are you thinking of picking up a copy of this book?
Let me know in the comments. ¡¦by writing lines of code in python Discover how in my new Ebook:Statistical Methods for Machine Learning It provides self-study tutorials on topics like:Hypothesis Tests, Correlation, Nonparametric Stats, Resampling, and much more¡¦ Skip the Academics. Just Results. Click to learn more. Hey! great article!
The post is informative and the topic is discussed is really good keep on sharing new things. Thanks. Comment  Name (required)  Email (will not be published) (required)  Website Hi, I'm Jason Brownlee, Ph.D.

My goal is to make developers like YOU awesome at applied machine learning."
