"site","date","headline","url_address","text"
"mastery",2018-08-10,"How to Develop a Skillful Machine Learning Time Series Forecasting Model","https://machinelearningmastery.com/how-to-develop-a-skilful-time-series-forecasting-model/","What do you do? This is a common situation; far more common than most people think. The problem can be reasonably well defined: So how do you tackle this problem? Unless you have been through this trial by fire, you may struggle. In all of these cases, you will benefit from working through the problem carefully and systematically. In this post, I want to give you a specific and actionable procedure that you can use to work through your time series forecasting problem. Let¡¯s get started. How to Develop a Skilful Time Series Forecasting ModelPhoto by Make it Kenya, some rights reserved. The goal of this process is to get a ¡°good enough¡± forecast model as fast as possible. This process may or may not deliver the best possible model, but it will deliver a good model: a model that is better than a baseline prediction, if such a model exists. Typically, this process will deliver a model that is 80% to 90% of what can be achieved on the problem. The process is fast. As such, it focuses on automation. Hyperparameters are searched rather than specified based on careful analysis. You are encouraged to test suites of models in parallel, rapidly getting an idea of what works and what doesn¡¯t. Nevertheless, the process is flexible, allowing you to circle back or go as deep as you like on a given step if you have the time and resources. This process is divided into four parts; they are: You will notice that the process is different from a classical linear work-through of a predictive modeling problem. This is because it is designed to get a working forecast model fast and then slow down and see if you can get a better model. What is your process for working through a new time series forecasting problem?
Share it below in the comments. The biggest mistake is skipping steps. For example, the mistake that almost all beginners make is going straight to modeling without a strong idea of what problem is being solved or how to robustly evaluate candidate solutions. This almost always results in a lot of wasted time. Slow down, follow the process, and complete each step. I recommend having separate code for each experiment that can be re-run at any time. This is important so that you can circle back when you discover a bug, fix the code, and re-run an experiment. You are running experiments and iterating quickly, but if you are sloppy, then you cannot trust any of your results. This is especially important when it comes to the design of your test harness for evaluating candidate models. Let¡¯s take a closer look at each step of the process. Define your time series problem. Some topics to consider and motivating questions within each topic are as follows: Answer each question even if you have to estimate or guess. Some useful tools to help get answers include: Update your answers to these questions as you learn more. Design a test harness that you can use to evaluate candidate models. This includes both the method used to estimate model skill and the metric used to evaluate predictions. Below is a common time series forecasting model evaluation scheme if you are looking for ideas: The test harness must be robust and you must have complete trust in the results it provides. An important consideration is to ensure that any coefficients used for data preparation are estimated from the training dataset only and then applied on the test set. This might include mean and standard deviation in the case of data standardization. Test many models using your test harness. I recommend carefully designing experiments to test a suite of configurations for standard models and letting them run. Each experiment can record results to a file, to allow you to quickly discover the top three to five most skilful configurations from each run. Some common classes of methods that you can design experiments around include the following: This list is based on a univariate time series forecasting problem, but you can adapt it for the specifics of your problem, e.g. use VAR/VARMA/etc. in the case of multivariate time series forecasting. Slot in more of your favorite classical time series forecasting methods and machine learning methods as you see fit. Order here is important and is structured in increasing complexity from classical to modern methods. Early approaches are simple and give good results fast; later approaches are slower and more complex, but also have a higher bar to clear to be skillful. The resulting model skill can be used in a ratchet. For example, the skill of the best persistence configuration provide a baseline skill that all other models must outperform. If an autoregression model does better than persistence, it becomes the new level to outperform in order for a method to be considered skilful. Ideally, you want to exhaust each level before moving on to the next. E.g. get the most out of Autoregression methods and use the results as a new baseline to define ¡°skilful¡± before moving on to Exponential Smoothing methods. I put deep learning at the end as generally neural networks are poor at time series forecasting, but there is still a lot of room for improvement and experimentation in this area. The more time and resources that you have, the more configurations that you can evaluate. For example, with more time and resources, you could: I also encourage you to include data preparation schemes as hyperparameters for model runs. Some methods will perform some basic data preparation, such as differencing in ARIMA, nevertheless, it is often unclear exactly what data preparation schemes or combinations of schemes are required to best present a dataset to a modeling algorithm. Rather than guess, grid search and decide based on real results. Some data preparation schemes to consider include: So much searching can be slow. Some ideas to speed up the evaluation of models include: At the end of the previous time step, you know whether your time series is predictable. If it is predictable, you will have a list of the top 5 to 10 candidate models that are skillful on the problem. You can pick one or multiple models and finalize them. This involves training a new final model on all available historical data (train and test). The model is ready for use; for example: If you have time, you can always circle back to the previous step and see if you can further improve upon the final model. This may be required periodically if the data changes significantly over time. This section provides more resources on the topic if you are looking to go deeper. In this post, you discovered a simple four-step process that you can use to quickly discover a skilful predictive model for your time series forecasting problem. Did you find this process useful?
Let me know below. Do you have any questions?
Ask your questions in the comments below and I will do my best to answer. ...with just a few lines of python code Discover how in my new Ebook:Introduction to Time Series Forecasting With Python It covers self-study tutorials and end-to-end projects on topics like:Loading data, visualization, modeling, algorithm tuning, and much more... Skip the Academics. Just Results. Click to learn more. What is the cost/price to develop forecasting regression model? What do you mean exactly? Comment  Name (required)  Email (will not be published) (required)  Website Hi, I'm Jason Brownlee, Ph.D.

My goal is to make developers like YOU awesome at applied machine learning. Read More"
"mastery",2018-08-08,"Taxonomy of Time Series Forecasting Problems","https://machinelearningmastery.com/taxonomy-of-time-series-forecasting-problems/","The choice that you make directly impacts each step of the project from the design of a test harness to evaluate forecast models to the fundamental difficulty of the forecast problem that you are working on. It is possible to very quickly narrow down the options by working through a series of questions about your time series forecasting problem. By considering a few themes and questions within each theme, you narrow down the type of problem, test harness, and even choice of algorithms for your project. In this post, you will discover a framework that you can use to quickly understand and frame your time series forecasting problem. Let¡¯s get started. Taxonomy of Time Series Forecasting ProblemsPhoto by Adam Meek, some rights reserved. Time series forecasting involves developing and using a predictive model on data where there is an ordered relationship between observations. You can learn more about what time series forecasting is in this post: Before you get started on your project, you can answer a few questions and greatly improve your understanding of the structure of your forecast problem, the structure of the model requires, and how to evaluate it. The framework presented in this post is divided into seven parts; they are: I recommend working through this framework before starting any time series forecasting project. Your answers may not be crisp on the first time through and the questions may require to you study the data, the domain, and talk to experts and stakeholders. Update your answers as you learn more as it will help to keep you on track, avoid distractions, and develop the actual model that you need for your project. Generally, a prediction problem involves using past observations to predict or forecast one or more possible future observations. The goal is to guess about what might happen in the future. When you are required to make a forecast, it is critical to think about the data that you will have available to make the forecast and what you will be guessing about the future. We can summarize this as what are the inputs and outputs of the model when making a single forecast. The input data is not the data used to train the model. We are not at that point yet. It is the data used to make one forecast, for example the last seven days of sales data to forecast the next one day of sales data. Defining the inputs and outputs of the model forces you to think about what exactly is or may be required to make a forecast. You may not be able to be specific when it comes to input data. For example, you may not know whether one or multiple prior time steps are required to make a forecast. But you will be able to identify the variables that could be used to make a forecast. What are the inputs and outputs for a forecast? The input data can be further subdivided in order to better understand its relationship to the output variable. An input variable is endogenous if it is affected by other variables in the system and the output variable depends on it. In a time series, the observations for an input variable depend upon one another. For example, the observation at time t is dependent upon the observation at t-1; t-1 may depend on t-2, and so on. An input variable is an exogenous variable if it is independent of other variables in the system and the output variable depends upon it. Put simply, endogenous variables are influenced by other variables in the system (including themselves) whereas as exogenous variables are not and are considered as outside the system. Typically, a time series forecasting problem has endogenous variables (e.g. the output is a function of some number of prior time steps) and may or may not have exogenous variables. Often, exogenous variables are ignored given the strong focus on the time series. Explicitly thinking about both variable types may help to identify easily overlooked exogenous data or even engineered features that may improve the model. What are the endogenous and exogenous variables? Regression predictive modeling problems are those where a quantity is predicted. A quantity is a numerical value; for example a price, a count, a volume, and so on. A time series forecasting problem in which you want to predict one or more future numerical values is a regression type predictive modeling problem. Classification predictive modeling problems are those where a category is predicted. A category is a label from a small well-defined set of labels; for example {¡°hot¡±, ¡°cold¡±}, {¡°up¡±, ¡°down¡±}, and {¡°buy¡±, ¡°sell¡±} are categories. A time series forecasting problem in which you want to classify input time series data is a classification type predictive modeling problem. Are you working on a regression or classification predictive modeling problem? There is some flexibility between these types. For example, a regression problem can be reframed as classification and a classification problem can be reframed as regression. Some problems, like predicting an ordinal value, can be framed as either classification and regression. It is possible that a reframing of your time series forecasting problem may simplify it. What are some alternate ways to frame your time series forecasting problem? It is useful to plot each variable in a time series and inspect the plot looking for possible patterns. A time series for a single variable may not have any obvious pattern. We can think of a series with no pattern as unstructured, as in there is no discernible time-dependent structure. Alternately, a time series may have obvious patterns, such as a trend or seasonal cycles as structured. We can often simplify the modeling process by identifying and removing the obvious structures from the data, such as an increasing trend or repeating cycle. Some classical methods even allow you to specify parameters to handle these systematic structures directly. Are the time series variables unstructured or structured? A single variable measured over time is referred to as a univariate time series. Univariate means one variate or one variable. Multiple variables measured over time is referred to as a multivariate time series: multiple variates or multiple variables. Are you working on a univariate or multivariate time series problem? Considering this question with regard to inputs and outputs may add a further distinction. The number of variables may differ between the inputs and outputs, e.g. the data may not be symmetrical. For example, you may have multiple variables as input to the model and only be interested in predicting one of the variables as output. In this case, there is an assumption in the model that the multiple input variables aid and are required in predicting the single output variable. A forecast problem that requires a prediction of the next time step is called a one-step forecast model. Whereas a forecast problem that requires a prediction of more than one time step is called a multi-step forecast model. The more time steps to be projected into the future, the more challenging the problem given the compounding nature of the uncertainty on each forecasted time step. Do you require a single-step or a multi-step forecast? It is possible to develop a model once and use it repeatedly to make predictions. Given that the model is not updated or changed between forecasts, we can think of this model as being static. Conversely, we may receive new observations prior to making a subsequent forecast that could be used to create a new model or update the existing model. We can think of developing a new or updated model prior to each forecasts as a dynamic problem. For example, it if the problem requires a forecast at the beginning of the week for the week ahead, we may receive the true observation at the end of the week that we can use to update the model prior to making next weeks forecast. This would be a dynamic model. If we do not get a true observation at the end of the week or we do and choose to not re-fit the model, this would be a static model. We may prefer a dynamic model, but the constraints of the domain or limitations of a chosen algorithm may impose constraints that make this intractable. Do you require a static or a dynamically updated model? A time series where the observations are uniform over time may be described as contiguous. Many time series problems have contiguous observations, such as one observation each hour, day, month or year. A time series where the observations are not uniform over time may be described as discontiguous. The lack of uniformity of the observations may be caused by missing or corrupt values. It may also be a feature of the problem where observations are only made available sporadically or at increasingly or decreasingly spaced time intervals. In the case of non-uniform observations, specific data formatting may be required when fitting some models to make the observations uniform over time. Are your observations contiguous or discontiguous? This section lists some resources for further reading. To review, the themes and questions you can ask about your problem are as follows: Did you find this framework useful for your time series forecasting problem?
Let me know in the comments below. Do you have any questions?
Ask your questions in the comments below and I will do my best to answer. ...with just a few lines of python code Discover how in my new Ebook:Introduction to Time Series Forecasting With Python It covers self-study tutorials and end-to-end projects on topics like:Loading data, visualization, modeling, algorithm tuning, and much more... Skip the Academics. Just Results. Click to learn more. Is there a flowchart or any other tool that helps make sense of the answers to the questions above? I.e. once we know the answers to the questions above how do we then choose an appropriate model for use with our data? Great question James! The next post scheduled (Friday) will answer exactly this question. Nice post. In Multi-Step forecast I would add that we could predict de difference, integral, etc, of the variable to predict over the future time ¡¦  There is one thing I did not understand 100% (I think) that is : Multivariate VS Multivariable terms ?  https://www.ncbi.nlm.nih.gov/pmc/articles/PMC3518362/ https://www.researchgate.net/post/Are_the_terms_multivariate_and_multivariable_the_same For instance the CO2 ¡°multivariate¡± time serie you have as example, according to these links is  ¡°Multivariate¡± or  ¡°Multivariable¡± ?  great work Thanks. Hi Jason, What approach do you recommend to forecast Forex rates? I have historical data about USD-INR currency pair and I wish to predict short, medium and long term forecast of this rate. I don¡¯t know anything about forex. Perhaps try this process:https://machinelearningmastery.com/how-to-develop-a-skilful-time-series-forecasting-model/ Comment  Name (required)  Email (will not be published) (required)  Website Hi, I'm Jason Brownlee, Ph.D.

My goal is to make developers like YOU awesome at applied machine learning. Read More"
