"site","date","headline","url_address","text"
"mastery",2018-11-23,"A Gentle Introduction to Weight Constraints to Reduce Generalization Error in Deep Learning","https://machinelearningmastery.com/introduction-to-weight-constraints-to-reduce-generalization-error-in-deep-learning/","Weight regularization methods like weight decay introduce a penalty to the loss function when training a neural network to encourage the network to use small weights. Smaller weights in a neural network can result in a model that is more stable and less likely to overfit the training dataset, in turn having better performance when making a prediction on new data. Unlike weight regularization, a weight constraint is a trigger that checks the size or magnitude of the weights and scales them so that they are all below a pre-defined threshold. The constraint forces weights to be small and can be used instead of weight decay and in conjunction with more aggressive network configurations, such as very large learning rates. In this post, you will discover the use of weight constraint regularization as an alternative to weight penalties to reduce overfitting in deep neural networks. After reading this post, you will know: Let¡¯s get started. A Gentle Introduction to Weight Constraints to Reduce Generalization Error in Deep LearningPhoto by Dawn Ellner, some rights reserved. Large weights in a neural network are a sign of overfitting. A network with large weights has very likely learned the statistical noise in the training data. This results in a model that is unstable, and very sensitive to changes to the input variables. In turn, the overfit network has poor performance when making predictions on new unseen data. A popular and effective technique to address the problem is to update the loss function that is optimized during training to take the size of the weights into account. This is called a penalty, as the larger the weights of the network become, the more the network is penalized, resulting in larger loss and, in turn, larger updates. The effect is that the penalty encourages weights to be small, or no larger than is required during the training process, in turn reducing overfitting. A problem in using a penalty is that although it does encourage the network toward smaller weights, it does not force smaller weights. A neural network trained with weight regularization penalty may still allow large weights, in some cases very large weights. An alternate solution to using a penalty for the size of network weights is to use a weight constraint. A weight constraint is an update to the network that checks the size of the weights, and if the size exceeds a predefined limit, the weights are rescaled so that their size is below the limit or between a range. You can think of a weight constraint as an if-then rule checking the size of the weights while the network is being trained and only coming into effect and making weights small when required. Note, for efficiency, it does not have to be implemented as an if-then rule and often is not. Unlike adding a penalty to the loss function, a weight constraint ensures the weights of the network are small, instead of mearly encouraging them to be small. It can be useful on those problems or with networks that resist other regularization methods, such as weight penalties. Weight constraints prove especially useful when you have configured your network to use alternative regularization methods to weight regularization and yet still desire the network to have small weights in order to reduce overfitting. One often-cited example is the use of a weight constraint regularization with dropout regularization. Although dropout alone gives significant improvements, using dropout along with [weight constraint] regularization, [¡¦] provides a significant boost over just using dropout. <U+2014> Dropout: A Simple Way to Prevent Neural Networks from Overfitting, 2014. A constraint is enforced on each node within a layer. All nodes within the layer use the same constraint, and often multiple hidden layers within the same network will use the same constraint. Recall that when we talk about the vector norm in general, that this is the magnitude of the vector of weights in a node, and by default is calculated as the L2 norm, e.g. the square root of the sum of the squared values in the vector. Some examples of constraints that could be used include: The maximum norm, also called max-norm or maxnorm, is a popular constraint because it is less aggressive than other norms such as the unit norm, simply setting an upper bound. Max-norm regularization has been previously used [¡¦] It typically improves the performance of stochastic gradient descent training of deep neural nets ¡¦ <U+2014> Dropout: A Simple Way to Prevent Neural Networks from Overfitting, 2014. When using a limit or a range, a hyperparameter must be specified. Given that weights are small, the hyperparameter too is often a small integer value, such as a value between 1 and 4. ¡¦ we can use max-norm regularization. This constrains the norm of the vector of incoming weights at each hidden unit to be bound by a constant c. Typical values of c range from 3 to 4. <U+2014> Dropout: A Simple Way to Prevent Neural Networks from Overfitting, 2014. If the norm exceeds the specified range or limit, the weights are rescaled or normalized such that their magnitude is below the specified parameter or within the specified range. If a weight-update violates this constraint, we renormalize the weights of the hidden unit by division. Using a constraint rather than a penalty prevents weights from growing very large no matter how large the proposed weight-update is. <U+2014> Improving neural networks by preventing co-adaptation of feature detectors, 2012. The constraint can be applied after each update to the weights, e.g. at the end of each mini-batch. This section provides a few cherry-picked examples from recent research papers where a weight constraint was used. Geoffrey Hinton, et al. in their 2012 paper titled ¡°Improving neural networks by preventing co-adaptation of feature detectors¡± used a maxnorm constraint on CNN models applied to the MNIST handwritten digit classification task and ImageNet photo classification task. All layers had L2 weight constraints on the incoming weights of each hidden unit. Nitish Srivastava, et al. in their 2014 paper titled ¡°Dropout: A Simple Way to Prevent Neural Networks from Overfitting¡± used a maxnorm constraint with an MLP on the MNIST handwritten digit classification task and with CNNs on the streetview house numbers dataset with the parameter configured via a holdout validation set. Max-norm regularization was used for weights in both convolutional and fully connected layers. Jan Chorowski, et al. in their 2015 paper titled ¡°Attention-Based Models for Speech Recognition¡± use LSTM and attention models for speech recognition with a max norm constraint set to 1. We first trained our models with a column norm constraint with the maximum norm 1 ¡¦ This section provides some tips for using weight constraints with your neural network. Weight constraints are a generic approach. They can be used with most, perhaps all, types of neural network models, not least the most common network types of Multilayer Perceptrons, Convolutional Neural Networks, and Long Short-Term Memory Recurrent Neural Networks. In the case of LSTMs, it may be desirable to use different constraints or constraint configurations for the input and recurrent connections. It is a good general practice to rescale input variables to have the same scale. When input variables have different scales, the scale of the weights of the network will, in turn, vary accordingly. This introduces a problem when using weight constraints because large weights will cause the constraint to trigger more frequently. This problem can be done by either normalization or standardization of input variables. The use of a weight constraint allows you to be more aggressive during the training of the network. Specifically, a larger learning rate can be used, allowing the network to, in turn, make larger updates to the weights each update. This is cited as an important benefit to using weight constraints. Such as the use of a constraint in conjunction with dropout: Using a constraint rather than a penalty prevents weights from growing very large no matter how large the proposed weight-update is. This makes it possible to start with a very large learning rate which decays during learning, thus allowing a far more thorough search of the weight-space than methods that start with small weights and use a small learning rate. <U+2014> Improving neural networks by preventing co-adaptation of feature detectors, 2012. Explore the use of other weight constraints, such as a minimum and maximum range, non-negative weights, and more. You may also choose to use constraints on some weights and not others, such as not using constraints on bias weights in an MLP or not using constraints on recurrent connections in an LSTM. This section provides more resources on the topic if you are looking to go deeper. In this post, you discovered the use of weight constraint regularization as an alternative to weight penalties to reduce overfitting in deep neural networks. Specifically, you learned: Do you have any questions?
Ask your questions in the comments below and I will do my best to answer. Hola Jason, Interesting post!  the ideas and presentations combine perfectly with weigh regularization, dropouts , normalizing, ¡¦well introduced in other post¡¦ Now I imagine you are thinking about, we would need to go trough specific implementations of those ideas via particular codes addressing some ML/DL problems, in order to explicitly known how Keras or scikit_Learn or other APIs libraries of functions operate specifically with those weighs constraint implementation¡¦ Thank you very much for your free work and big effort on behalf of this big and universal community to approach these techniques and ideas for developers and enthusiats of ML/DL techniques ! we  owe a lot to you ! Thanks.  Yes, I¡¯m working on a whole series of neural net regularization posts that will culminate in a new book. Comment  Name (required)  Email (will not be published) (required)  Website"
"mastery",2018-11-21,"How to Reduce Overfitting of a Deep Learning Model with Weight Regularization","https://machinelearningmastery.com/how-to-reduce-overfitting-in-deep-learning-with-weight-regularization/","Weight regularization provides an approach to reduce the overfitting of a deep learning neural network model on the training data and improve the performance of the model on new data, such as the holdout test set. There are multiple types of weight regularization, such as L1 and L2 vector norms, and each requires a hyperparameter that must be configured. In this tutorial, you will discover how to apply weight regularization to improve the performance of an overfit deep learning neural network in Python with Keras. After completing this tutorial, you will know: Let¡¯s get started. How to Reduce Overfitting in Deep Learning With Weight RegularizationPhoto by Seabamirum, some rights reserved. This tutorial is divided into three parts; they are: Keras provides a weight regularization API that allows you to add a penalty for weight size to the loss function. Three different regularizer instances are provided; they are: The regularizers are provided under keras.regularizers and have the names l1, l2 and l1_l2. Each takes the regularizer hyperparameter as an argument. For example: By default, no regularizer is used in any layers. A weight regularizer can be added to each layer when the layer is defined in a Keras model. This is achieved by setting the kernel_regularizer argument on each layer. A separate regularizer can also be used for the bias via the bias_regularizer argument, although this is less often used. Let¡¯s look at some examples. The example below sets an l2 regularizer on a Dense fully connected layer: Like the Dense layer, the Convolutional layers (e.g. Conv1D and Conv2D) also use the kernel_regularizer and bias_regularizer arguments to define a regularizer. The example below sets an l2 regularizer on a Conv2D convolutional layer: Recurrent layers like the LSTM offer more flexibility in regularizing the weights. The input, recurrent, and bias weights can all be regularized separately via the kernel_regularizer, recurrent_regularizer, and bias_regularizer arguments. The example below sets an l2 regularizer on an LSTM recurrent layer: It can be helpful to look at some examples of weight regularization configurations reported in the literature. It is important to select and tune a regularization technique specific to your network and dataset, although real examples can also give an idea of common configurations that may be a useful starting point. Recall that 0.1 can be written in scientific notation as 1e-1 or 1E-1 or as an exponential 10^-1, 0.01 as 1e-2 or 10^-2 and so on. Weight regularization was borrowed from penalized regression models in statistics. The most common type of regularization is L2, also called simply ¡°weight decay,¡± with values often on a logarithmic scale between 0 and 0.1, such as 0.1, 0.001, 0.0001, etc. Reasonable values of lambda [regularization hyperparameter] range between 0 and 0.1. <U+2014> Page 144, Applied Predictive Modeling, 2013. The classic text on Multilayer Perceptrons ¡°Neural Smithing: Supervised Learning in Feedforward Artificial Neural Networks¡± provides a worked example demonstrating the impact of weight decay by first training a model without any regularization, then steadily increasing the penalty. They demonstrate graphically that weight decay has the effect of improving the resulting decision function. ¡¦ net was trained [¡¦] with weight decay increasing from 0 to 1E-5 at 1200 epochs, to 1E-4 at 2500 epochs, and to 1E-3 at 400 epochs. [¡¦] The surface is smoother and transitions are more gradual <U+2014> Page 270, Neural Smithing: Supervised Learning in Feedforward Artificial Neural Networks, 1999. This is an interesting procedure that may be worth investigating. The authors also comment on the difficulty of predicting the effect of weight decay on a problem. ¡¦ it is difficult to predict ahead of time what value is needed to achieve desired results. The value of 0.001 was chosen arbitrarily because it is a typically cited round number <U+2014> Page 270, Neural Smithing: Supervised Learning in Feedforward Artificial Neural Networks, 1999. Weight regularization does not seem widely used in CNN models, or if it is used, its use is not widely reported. L2 weight regularization with very small regularization hyperparameters such as (e.g. 0.0005 or 5 x 10^<U+2212>4) may be a good starting point. Alex Krizhevsky, et al. from the University of Toronto in their 2012 paper titled ¡°ImageNet Classification with Deep Convolutional Neural Networks¡± developed a deep CNN model for the ImageNet dataset, achieving then state-of-the-art results reported: ¡¦and weight decay of 0.0005. We found that this small amount of weight decay was important for the model to learn. In other words, weight decay here is not merely a regularizer: it reduces the model¡¯s training error. Karen Simonyan and Andrew Zisserman from Oxford in their 2015 paper titled ¡°Very Deep Convolutional Networks for Large-Scale Image Recognition¡± develop a CNN for the ImageNet dataset and report: The training was regularised by weight decay (the L2 penalty multiplier set to 5 x 10^<U+2212>4) Francois Chollet from Google (and author of Keras) in his 2016 paper titled ¡°Xception: Deep Learning with Depthwise Separable Convolutions¡± reported the weight decay for both the Inception V3 CNN model from Google (not clear from the Inception V3 paper) and the weight decay used in his improved Xception for the ImageNet dataset: The Inception V3 model uses a weight decay (L2 regularization) rate of 4e<U+2212>5, which has been carefully tuned for performance on ImageNet. We found this rate to be quite suboptimal for Xception and instead settled for 1e<U+2212>5. It is common to use weight regularization with LSTM models. An often used configuration is L2 (weight decay) and very small hyperparameters (e.g. 10^<U+2212>6). It is often not reported what weights are regularized (input, recurrent, and/or bias), although one would assume that both input and recurrent weights are regularized only. Gabriel Pereyra, et al. from Google Brain in the 2017 paper titled ¡°Regularizing Neural Networks by Penalizing Confident Output Distributions¡± apply a seq2seq LSTMs models to predicting characters from the Wall Street Journal and report: All models used weight decay of 10^<U+2212>6 Barret Zoph and Quoc Le from Google Brain in the 2017 paper titled ¡°Neural Architecture Search with Reinforcement Learning¡± use LSTMs and reinforcement learning to learn network architectures to best address the CIFAR-10 dataset and report: weight decay of 1e-4 Ron Weiss, et al. from Google Brain and Nvidia in their 2017 paper titled ¡°Sequence-to-Sequence Models Can Directly Translate Foreign Speech¡± develop a sequence-to-sequence LSTM for speech translation and report: L2 weight decay is used with a weight of 10^<U+2212>6 In this section, we will demonstrate how to use weight regularization to reduce overfitting of an MLP on a simple binary classification problem. This example provides a template for applying weight regularization to your own neural network for classification and regression problems. We will use a standard binary classification problem that defines two semi-circles of observations: one semi-circle for each class. Each observation has two input variables with the same scale and a class output value of either 0 or 1. This dataset is called the ¡°moons¡± dataset because of the shape of the observations in each class when plotted. We can use the make_moons() function to generate observations from this problem. We will add noise to the data and seed the random number generator so that the same samples are generated each time the code is run. We can plot the dataset where the two variables are taken as x and y coordinates on a graph and the class value is taken as the color of the observation. The complete example of generating the dataset and plotting it is listed below. Running the example creates a scatter plot showing the semi-circle or moon shape of the observations in each class. We can see the noise in the dispersal of the points making the moons less obvious. Scatter Plot of Moons Dataset With Color Showing the Class Value of Each Sample This is a good test problem because the classes cannot be separated by a line, e.g. are not linearly separable, requiring a nonlinear method such as a neural network to address. We have only generated 100 samples, which is small for a neural network, providing the opportunity to overfit the training dataset and have higher error on the test dataset: a good case for using regularization. Further, the samples have noise, giving the model an opportunity to learn aspects of the samples that don¡¯t generalize. We can develop an MLP model to address this binary classification problem. The model will have one hidden layer with more nodes that may be required to solve this problem, providing an opportunity to overfit. We will also train the model for longer than is required to ensure the model overfits. Before we define the model, we will split the dataset into train and test sets, using 30 examples to train the model and 70 to evaluate the fit model¡¯s performance. Next, we can define the model. The model uses 500 nodes in the hidden layer and the rectified linear activation function. A sigmoid activation function is used in the output layer in order to predict class values of 0 or 1. The model is optimized using the binary cross entropy loss function, suitable for binary classification problems and the efficient Adam version of gradient descent. The defined model is then fit on the training data for 4,000 epochs and the default batch size of 32. Finally, we can evaluate the performance of the model on the test dataset and report the result. We can tie all of these pieces together; the complete example is listed below. Running the example reports the model performance on the train and test datasets. We can see that the model has better performance on the training dataset than the test dataset, one possible sign of overfitting. Your specific results may vary given the stochastic nature of the neural network and the training algorithm. Because the model is severely overfit, we generally would not expect much, if any, variance in the accuracy across repeated runs of the model on the same dataset. Another sign of overfitting is a plot of the learning curves of the model for both train and test datasets while training. An overfit model should show accuracy increasing on both train and test and at some point accuracy drops on the test dataset but continues to rise on the test dataset. We can update the example to plot these curves. The complete example is listed below. Running the example creates line plots of the model accuracy on the train and test sets. We can see an expected shape of an overfit model where test accuracy increases to a point and then begins to decrease again. Line Plots of Accuracy on Train and Test Datasets While Training We can add weight regularization to the hidden layer to reduce the overfitting of the model to the training dataset and improve the performance on the holdout set. We will use the L2 vector norm also called weight decay with a regularization parameter (called alpha or lambda) of 0.001, chosen arbitrarily. This can be done by adding the kernel_regularizer argument to the layer and setting it to an instance of l2. The updated example of fitting and evaluating the model on the moons dataset with weight regularization is listed below. Running the example reports the performance of the model on the train and test datasets. We can see no change in the accuracy on the training dataset and an improvement on the test dataset. We would expect that the telltale learning curve for overfitting would also have been changed through the use of weight regularization. Instead of the accuracy of the model on the test set increasing and then decreasing again, we should see it continually rise during training. The complete example of fitting the model and plotting the train and test learning curves is listed below. Running the example creates line plots of the train and test accuracy for the model for each epoch during training. As expected, we see the learning curve on the test dataset rise and then plateau, indicating that the model may not have overfit the training dataset. Line Plots of Accuracy on Train and Test Datasets While Training Without Overfitting Once you can confirm that weight regularization may improve your overfit model, you can test different values of the regularization parameter. It is a good practice to first grid search through some orders of magnitude between 0.0 and 0.1, then once a level is found, to grid search on that level. We can grid search through the orders of magnitude by defining the values to test, looping through each and recording the train and test performance. Once we have all of the values, we can graph the results as a line plot to help spot any patterns in the configurations to the train and test accuracies. Because parameters jump orders of magnitude (powers of 10), we can create a line plot of the results using a logarithmic scale. The Matplotlib library allows this via the semilogx() function. For example: The complete example for grid searching weight regularization values on the moon dataset is listed below. Running the example prints the parameter value and the accuracy on the train and test sets for each evaluated model. The results suggest that 0.01 or 0.001 may be sufficient and may provide good bounds for further grid searching. A line plot of the results is also created, showing the increase in test accuracy with larger weight regularization parameter values, at least to a point. We can see that using the largest value of 0.1 results in a large drop in both train and test accuracy. Line Plot of Model Accuracy on Train and Test Datasets With Different Weight Regularization Parameters This section lists some ideas for extending the tutorial that you may wish to explore. If you explore any of these extensions, I¡¯d love to know. This section provides more resources on the topic if you are looking to go deeper. In this tutorial, you discovered how to apply weight regularization to improve the performance of an overfit deep learning neural network in Python with Keras. Specifically, you learned: Do you have any questions?
Ask your questions in the comments below and I will do my best to answer. Comment  Name (required)  Email (will not be published) (required)  Website"
