"site","date","headline","url_address","text"
"mastery",2018-08-06,"11 Classical Time Series Forecasting Methods in Python (Cheat Sheet)","https://machinelearningmastery.com/time-series-forecasting-methods-in-python-cheat-sheet/","Before exploring machine learning methods for time series, it is a good idea to ensure you have exhausted classical linear time series forecasting methods. Classical time series forecasting methods may be focused on linear relationships, nevertheless, they are sophisticated and perform well on a wide range of problems, assuming that your data is suitably prepared and the method is well configured. In this post, will you will discover a suite of classical methods for time series forecasting that you can test on your forecasting problem prior to exploring to machine learning methods. The post is structured as a cheat sheet to give you just enough information on each method to get started with a working code example and where to look to get more information on the method. All code examples are in Python and use the Statsmodels library. The APIs for this library can be tricky for beginners (trust me!), so having a working code example as a starting point will greatly accelerate your progress. This is a large post; you may want to bookmark it. Let¡¯s get started. 11 Classical Time Series Forecasting Methods in Python (Cheat Sheet)Photo by Ron Reiring, some rights reserved. This cheat sheet demonstrates 11 different classical time series forecasting methods; they are: Did I miss your favorite classical time series forecasting method?
Let me know in the comments below. Each method is presented in a consistent manner. This includes: Each code example is demonstrated on a simple contrived dataset that may or may not be appropriate for the method. Replace the contrived dataset with your data in order to test the method. Remember: each method will require tuning to your specific problem. In many cases, I have examples of how to configure and even grid search parameters on the blog already, try the search function. If you find this cheat sheet useful, please let me know in the comments below. The autoregression (AR) method models the next step in the sequence as a linear function of the observations at prior time steps. The notation for the model involves specifying the order of the model p as a parameter to the AR function, e.g. AR(p). For example, AR(1) is a first-order autoregression model. The method is suitable for univariate time series without trend and seasonal components. The moving average (MA) method models the next step in the sequence as a linear function of the residual errors from a mean process at prior time steps. A moving average model is different from calculating the moving average of the time series. The notation for the model involves specifying the order of the model q as a parameter to the MA function, e.g. MA(q). For example, MA(1) is a first-order moving average model. The method is suitable for univariate time series without trend and seasonal components. We can use the ARMA class to create an MA model and setting a zeroth-order AR model. We must specify the order of the MA model in the order argument. The Autoregressive Moving Average (ARMA) method models the next step in the sequence as a linear function of the observations and resiudal errors at prior time steps. It combines both Autoregression (AR) and Moving Average (MA) models. The notation for the model involves specifying the order for the AR(p) and MA(q) models as parameters to an ARMA function, e.g. ARMA(p, q). An ARIMA model can be used to develop AR or MA models. The method is suitable for univariate time series without trend and seasonal components. The Autoregressive Integrated Moving Average (ARIMA) method models the next step in the sequence as a linear function of the differenced observations and residual errors at prior time steps. It combines both Autoregression (AR) and Moving Average (MA) models as well as a differencing pre-processing step of the sequence to make the sequence stationary, called integration (I). The notation for the model involves specifying the order for the AR(p), I(d), and MA(q) models as parameters to an ARIMA function, e.g. ARIMA(p, d, q). An ARIMA model can also be used to develop AR, MA, and ARMA models. The method is suitable for univariate time series with trend and without seasonal components. The Seasonal Autoregressive Integrated Moving Average (SARIMA) method models the next step in the sequence as a linear function of the differenced observations, errors, differenced seasonal observations, and seasonal errors at prior time steps. It combines the ARIMA model with the ability to perform the same autoregression, differencing, and moving average modeling at the seasonal level. The notation for the model involves specifying the order for the AR(p), I(d), and MA(q) models as parameters to an ARIMA function and AR(P), I(D), MA(Q) and m parameters at the seasonal level, e.g. SARIMA(p, d, q)(P, D, Q)m where ¡°m¡± is the number of time steps in each season (the seasonal period). A SARIMA model can be used to develop AR, MA, ARMA and ARIMA models. The method is suitable for univariate time series with trend and/or seasonal components. The Seasonal Autoregressive Integrated Moving-Average with Exogenous Regressors (SARIMAX) is an extension of the SARIMA model that also includes the modeling of exogenous variables. Exogenous variables are also called covariates and can be thought of as parallel input sequences that have observations at the same time steps as the original series. The primary series may be referred to as endogenous data to contrast it from the exogenous sequence(s). The observations for exogenous variables are included in the model directly at each time step and are not modeled in the same way as the primary endogenous sequence (e.g. as an AR, MA, etc. process). The SARIMAX method can also be used to model the subsumed models with exogenous variables, such as ARX, MAX, ARMAX, and ARIMAX. The method is suitable for univariate time series with trend and/or seasonal components and exogenous variables. The Vector Autoregression (VAR) method models the next step in each time series using an AR model. It is the generalization of AR to multiple parallel time series, e.g. multivariate time series. The notation for the model involves specifying the order for the AR(p) model as parameters to a VAR function, e.g. VAR(p). The method is suitable for multivariate time series without trend and seasonal components. The Vector Autoregression Moving-Average (VARMA) method models the next step in each time series using an ARMA model. It is the generalization of ARMA to multiple parallel time series, e.g. multivariate time series. The notation for the model involves specifying the order for the AR(p) and MA(q) models as parameters to a VARMA function, e.g. VARMA(p, q). A VARMA model can also be used to develop VAR or VMA models. The method is suitable for multivariate time series without trend and seasonal components. The Vector Autoregression Moving-Average with Exogenous Regressors (VARMAX) is an extension of the VARMA model that also includes the modeling of exogenous variables. It is a multivariate version of the ARMAX method. Exogenous variables are also called covariates and can be thought of as parallel input sequences that have observations at the same time steps as the original series. The primary series(es) are referred to as endogenous data to contrast it from the exogenous sequence(s). The observations for exogenous variables are included in the model directly at each time step and are not modeled in the same way as the primary endogenous sequence (e.g. as an AR, MA, etc. process). The VARMAX method can also be used to model the subsumed models with exogenous variables, such as VARX and VMAX. The method is suitable for univariate time series without trend and seasonal components and exogenous variables. The Simple Exponential Smoothing (SES) method models the next time step as an exponentially weighted linear function of observations at prior time steps. The method is suitable for univariate time series without trend and seasonal components. The Holt Winter¡¯s Exponential Smoothing (HWES) also called the Triple Exponential Smoothing method models the next time step as an exponentially weighted linear function of observations at prior time steps, taking trends and seasonality into account. The method is suitable for univariate time series with trend and/or seasonal components. This section provides more resources on the topic if you are looking to go deeper. In this post, you discovered a suite of classical time series forecasting methods that you can test and tune on your time series dataset. Did I miss your favorite classical time series forecasting method?
Let me know in the comments below. Did you try any of these methods on your dataset?
Let me know about your findings in the comments. Do you have any questions?
Ask your questions in the comments below and I will do my best to answer. ...with just a few lines of python code Discover how in my new Ebook:Introduction to Time Series Forecasting With Python It covers self-study tutorials and end-to-end projects on topics like:Loading data, visualization, modeling, algorithm tuning, and much more... Skip the Academics. Just Results. Click to learn more. Hi Jason, thanks for such an excellent and comprehensive post on time series. I sincerely appreciate your effort.  As you ask for the further topic, just wondering if I can request you for a specific topic I have been struggling to get an output. It¡¯s about Structural Dynamic Factor model ( SDFM) by Barigozzi, M., Conti, A., and Luciani, M. (Do euro area countries respond asymmetrically to the common monetary policy) and Mario Forni Luca Gambetti (The Dynamic Effects of Monetary Policy: A Structural Factor Model Approach). Would it be possible for you to go over and estimate these two models using Python or R? It¡¯s just a request from me and sorry if it doesn¡¯t go with your interest. Thanks for the suggestion. I¡¯ve not heard of that method before. I am working on Time series or Prediction  with neural network and SVR, I want to this in matlab by scratch can you give me the references of this materials
 Thank you in advance Sorry, I don¡¯t have any materials for matlab, it is only really used in universities. Hi Jason! From which editor do you import the python code into the webpage of your article? Or what kind of container it that windowed control used to display the python code? Great question, I explain the software I use for the website here:https://machinelearningmastery.com/faq/single-faq/what-software-do-you-use-to-run-your-website Thanks for all the things to try! I recently stumbled over some tasks where the classic algorithms like linear regression or decision trees outperformed even sophisticated NNs. Especially when boosted or averaged out with each other. Maybe its time to try the same with time series forecasting as I¡¯m not getting good results for some tasks with an LSTM. Always start with simple methods before trying more advanced methods.  The complexity of advanced methods just be justified by additional predictive skill. Hi Jason, Thanks for this nice post! You¡¯ve imported the sin function from math many times but have not used it. I¡¯d like to see more posts about GARCH, ARCH and co-integration models. Best,
Elie Thanks, fixed. I have a post on ARCH (and friends) scheduled. Will you consider writing a follow-up book on advanced time-series models soon? Yes, it is written. I am editing it now. The title will be ¡°Deep Learning for Time Series Forecasting¡±. CNNs are amazing at time series, and CNNs + LSTMs together are really great. will the new book cover classical time-series models like VAR, GARCH, ..? The focus is deep learning (MLP, CNN and LSTM) with tutorials on how to get the most from classical methods (Naive, SARIMA, ETS) before jumping into deep learning methods. I hope to have it done by the end of the month. This is great news! Don¡¯t you think that R is better suited than Python for classical time-series models? Perhaps generally, but not if you are building a system for operational use. I think Python is a better fit. Great to hear this news. May I ask if the book also cover the topic of multivariate and multistep? Yes, there are many chapters on multi-step and most chapters work with multivariate data. Sounds amazing that you finally <U+0001F609> are geting the new book out on time-series models <U+2013> when will it be available to buy? Thanks. I hope by the end of the month or soon after. I use Prophet.https://facebook.github.io/prophet/docs/quick_start.html Also, sometimes FastFourier Transformations gives a good result. Thanks. What are the typical application domain of these algos? Forecasting a time series across domains. Hi Jason!
Firstly I congratulate you for your blog. It is helping me a lot in my final work on my bachelor¡¯s degree in Statistics!
What are the assumptions for make forecasting on time series using Machine Learning algorithms? For example, it must to be stationary? Thanks! Gaussian error, but they work anyway if you violate assumptions. The methods like SARIMA/ETS try to make the series stationary as part of modeling (e.g. differencing). You may want to look at power transforms to make data more Gaussian. Comment  Name (required)  Email (will not be published) (required)  Website Hi, I'm Jason Brownlee, Ph.D.

My goal is to make developers like YOU awesome at applied machine learning. Read More"
