site,date,headline,url_address,text
mastery,2018-07-09,How to Calculate Nonparametric Rank Correlation in Python,https://machinelearningmastery.com/how-to-calculate-nonparametric-rank-correlation-in-python/,"Correlation is a measure of the association between two variables. It is easy to calculate and interpret when both variables have a well understood Gaussian distribution. When we do not know the distribution of the variables, we must use nonparametric rank correlation methods. In this tutorial, you will discover rank correlation methods for quantifying the association between variables with a non-Gaussian distribution. After completing this tutorial, you will know: Let¡¯s get started. This tutorial is divided into 4 parts; they are: Take my free 7-day email crash course now (with sample code). Click to sign-up and also get a free PDF Ebook version of the course. Download Your FREE Mini-Course Correlation refers to the association between the observed values of two variables. The variables may have a positive association, meaning that as the values for one variable increase, so do the values of the other variable. The association may also be negative, meaning that as the values of one variable increase, the values of the others decrease. Finally, the association may be neutral, meaning that the variables are not associated. Correlation quantifies this association, often as a measure between the values -1 to 1 for perfectly negatively correlated and perfectly positively correlated. The calculated correlation is referred to as the ¡°correlation coefficient.¡± This correlation coefficient can then be interpreted to describe the measures. See the table below to help with interpretation the correlation coefficient. Table of Correlation Coefficient Values and Their InterpretationTaken from ¡°Nonparametric Statistics for Non-Statisticians: A Step-by-Step Approach¡±. The correlation between two variables that each have a Gaussian distribution can be calculated using standard methods such as the Pearson¡¯s correlation. This procedure cannot be used for data that does not have a Gaussian distribution. Instead, rank correlation methods must be used. Rank correlation refers to methods that quantify the association between variables using the ordinal relationship between the values rather than the specific values. Ordinal data is data that has label values and has an order or rank relationship; for example: ¡®low¡®, ¡®medium¡®, and ¡®high¡®. Rank correlation can be calculated for real-valued variables. This is done by first converting the values for each variable into rank data. This is where the values are ordered and assigned an integer rank value. Rank correlation coefficients can then be calculated in order to quantify the association between the two ranked variables. Because no distribution for the values is assumed, rank correlation methods are referred to as distribution-free correlation or nonparametric correlation. Interestingly, rank correlation measures are often used as the basis for other statistical hypothesis tests, such as determining whether two samples were likely drawn from the same (or different) population distributions. Rank correlation methods are often named after the researcher or researchers that developed the method. Four examples of rank correlation methods are as follows: In the following sections, we will take a closer look at two of the more common rank correlation methods: Spearman¡¯s and Kendall¡¯s. Before we demonstrate rank correlation methods, we must first define a test problem. In this section, we will define a simple two-variable dataset where each variable is drawn from a uniform distribution (e.g. non-Gaussian) and the values of the second variable depend on the values of the first value. Specifically, a sample of 1,000 random floating point values are drawn from a uniform distribution and scaled to the range 0 to 20. A second sample of 1,000 random floating point values are drawn from a uniform distribution between 0 and 10 and added to values in the first sample to create an association. The complete example is listed below. Running the example generates the data sample and graphs the points on a scatter plot. We can clearly see that each variable has a uniform distribution and the positive association between the variables is visible by the diagonal grouping of the points from the bottom left to the top right of the plot. Scatter Plot of Associated Variables Drawn From a Uniform Distribution Spearman¡¯s rank correlation is named for Charles Spearman. It may also be called Spearman¡¯s correlation coefficient and is denoted by the lowercase greek letter rho (p). As such, it may be referred to as Spearman¡¯s rho. This statistical method quantifies the degree to which ranked variables are associated by a monotonic function, meaning an increasing or decreasing relationship. As a statistical hypothesis test, the method assumes that the samples are uncorrelated (fail to reject H0). The Spearman rank-order correlation is a statistical procedure that is designed to measure the relationship between two variables on an ordinal scale of measurement. <U+2014> Page 124, Nonparametric Statistics for Non-Statisticians: A Step-by-Step Approach, 2009. The intuition for the Spearman¡¯s rank correlation is that it calculates a Pearson¡¯s correlation (e.g. a parametric measure of correlation) using the rank values instead of the real values. Where the Pearson¡¯s correlation is the calculation of the covariance (or expected difference of observations from the mean) between the two variables normalized by the variance or spread of both variables. Spearman¡¯s rank correlation can be calculated in Python using the spearmanr() SciPy function. The function takes two real-valued samples as arguments and returns both the correlation coefficient in the range between -1 and 1 and the p-value for interpreting the significance of the coefficient. We can demonstrate the Spearman¡¯s rank correlation on the test dataset. We know that there is a strong association between the variables in the dataset and we would expect the Spearman¡¯s test to find this association. The complete example is listed below. Running the example calculates the Spearman¡¯s correlation coefficient between the two variables in the test dataset. The statistical test reports a strong positive correlation with a value of 0.9. The p-value is close to zero, which means that the likelihood of observing the data given that the samples are uncorrelated is very unlikely (e.g. 95% confidence) and that we can reject the null hypothesis that the samples are uncorrelated. Kendall¡¯s rank correlation is named for Maurice Kendall. It is also called Kendall¡¯s correlation coefficient, and the coefficient is often referred to by the lowercase Greek letter tau (t). In turn, the test may be called Kendall¡¯s tau. The intuition for the test is that it calculates a normalized score for the number of matching or concordant rankings between the two samples. As such, the test is also referred to as Kendall¡¯s concordance test. The Kendall¡¯s rank correlation coefficient can be calculated in Python using the kendalltau() SciPy function. The test takes the two data samples as arguments and returns the correlation coefficient and the p-value. As a statistical hypothesis test, the method assumes (H0) that there is no association between the two samples. We can demonstrate the calculation on the test dataset, where we do expect a significant positive association to be reported. The complete example is listed below. Running the example calculates the Kendall¡¯s correlation coefficient as 0.7, which is highly correlated. The p-value is close to zero (and printed as zero), as with the Spearman¡¯s test, meaning that we can confidently reject the null hypothesis that the samples are uncorrelated. This section lists some ideas for extending the tutorial that you may wish to explore. If you explore any of these extensions, I¡¯d love to know. This section provides more resources on the topic if you are looking to go deeper. In this tutorial, you discovered rank correlation methods for quantifying the association between variables with a non-Gaussian distribution. Specifically, you learned: Do you have any questions?
Ask your questions in the comments below and I will do my best to answer. ¡¦by writing lines of code in python Discover how in my new Ebook:Statistical Methods for Machine Learning It provides self-study tutorials on topics like:Hypothesis Tests, Correlation, Nonparametric Stats, Resampling, and much more¡¦ Skip the Academics. Just Results. Click to learn more. Hello Jason! I¡¯m starting to make some projects using machine learning and i have a doubt. Can I use these ranking correlations to select atributes for a machine learning project?
What is the best for this use? Thanks! Your blog is helping me a lot to get improved at the machine learning area! Yes, try it.  There are many ways to select features for ML, try a few and go with the method that results in a model with the best performance.  There is no best, instead, there are many different methods to try for your problem. Thank you! Hi Jason!
i got really lots of information from your articales. do you have examples or articles about reinforcement? Not at this stage, perhaps in the future. Hi Jason, Your articles about machine learning and data Science is helping me improve on my data coding skills and data Science generally.
Many thanks Yusuf I¡¯m glad to hear that. Hey Jason, Keep up the good work man.
I love ¡¯em your blogs.
It helps me a lot. Thanks,
Yaser Comment  Name (required)  Email (will not be published) (required)  Website Hi, I'm Jason Brownlee, Ph.D.

My goal is to make developers like YOU awesome at applied machine learning."
